{
  "schemaVersion": 1,
  "compiler": {
    "family": "gcc",
    "version": "2.95.2",
    "source": {
      "origin": "harness",
      "path": "tools/vendor/gcc/2.95.2"
    },
    "capabilities": [
      "gcc-rtl-dumps",
      "gcc-emission-attribution",
      "gcc-implicit-declarations"
    ]
  },
  "tools": {
    "cc1": {
      "origin": "runtime",
      "path": "dependencies/compiler/gcc-2.95.2-psx/cc1"
    },
    "cpp": "mips-linux-gnu-cpp",
    "as": "mips-linux-gnu-as",
    "ld": "mips-linux-gnu-ld",
    "objcopy": "mips-linux-gnu-objcopy",
    "objdump": "mips-linux-gnu-objdump",
    "nm": "mips-linux-gnu-nm",
    "readelf": "mips-linux-gnu-readelf",
    "python": "python3",
    "splat": "splat",
    "spimdisasm": "spimdisasm",
    "maspsx": {
      "origin": "runtime",
      "path": "dependencies/maspsx/0249ed2752a100eed95e8b4124f94af859398ca9/maspsx.py"
    },
    "m2c": {
      "origin": "runtime",
      "path": "dependencies/m2c/cd96c559d54ea8644177e89cee07e4f0b0ac4825/m2c.py"
    }
  },
  "includeDirs": [
    "include",
    "library-input/psyq/INCLUDE"
  ],
  "flags": {
    "cpp": [
      "-undef",
      "-D__GNUC__=2",
      "-DINCLUDE_ASM_USE_MACRO_INC=1",
      "-lang-c",
      "-D_LANGUAGE_C"
    ],
    "cc1": [
      "-O2",
      "-G8",
      "-mips1",
      "-mcpu=r3000",
      "-funsigned-char",
      "-fpeephole",
      "-ffunction-cse",
      "-fpcc-struct-return",
      "-fcommon",
      "-fverbose-asm",
      "-msoft-float",
      "-mgas",
      "-fgnu-linker",
      "-quiet"
    ],
    "as": [
      "-march=r3000",
      "-mtune=r3000",
      "-EL",
      "-G8",
      "-no-pad-sections"
    ],
    "ld": [
      "-EL"
    ],
    "maspsx": [
      "--aspsx-version",
      "2.80",
      "--use-comm-section",
      "--run-assembler"
    ],
    "m2c": [
      "--target",
      "mipsel-gcc-c"
    ],
    "spimdisasm": [
      "--arch-level",
      "MIPS1",
      "--instr-category",
      "r3000gte",
      "--compiler",
      "PSYQ",
      "--endian",
      "little"
    ]
  },
  "profiles": {},
  "containerProfiles": {},
  "sdk": {
    "version": "470",
    "convertedDir": "lib",
    "originalDir": "library-input/psyq/LIB",
    "signatures": {
      "origin": "runtime",
      "path": "dependencies/psx_psyq_signatures/e9e46e7e133ef275a79bfce650924f98edb086bc/470"
    },
    "headers": {
      "origin": "project",
      "path": "library-input/psyq/INCLUDE"
    }
  }
}
